{
  "paese": "PRK",
  "periodo": "2020-Q3",
  "conflitto": {
    "descrizione": null
  },
  "carestia": {
    "livello_ipc": "non_specificato",
    "descrizione": null
  },
  "migrazione": {
    "descrizione": null
  },
  "economia": {
    "sintesi": null
  },
  "cyber": {
    "incidenti_noti": [],
    "advisory_che_menzionano_il_paese": [
      "FASTCash 2.0: North Korea's BeagleBoyz Robbing Banks"
    ],
    "gruppi_minaccia_associati": [
      "BeagleBoyz"
    ],
    "settori_bersaglio": [
      "Bancario",
      "Servizi finanziari",
      "Servizi professionali",
      "Organizzazioni internazionali",
      "Organizzazioni non governative",
      "Istituzioni governative",
      "Istituzioni militari",
      "Istituzioni legislative",
      "Istituzioni di istruzione superiore",
      "Fornitori di servizi IT"
    ],
    "ruolo": "attore"
  },
  "contesto_generale": "Nel terzo trimestre del 2020, la Corea del Nord ha continuato a sperimentare una serie di eventi politici, militari e umanitari significativi. Nel mese di agosto, la Corea del Nord ha subito gravi piogge e alluvioni, causando danni significativi e perdite di vite umane. Il paese ha rifiutato l'assistenza esterna a causa delle preoccupazioni legate alla pandemia di COVID-19. Nel corso del trimestre, sono state effettuate diverse prove di missili, con un aumento notevole nel numero di lanci rispetto ai periodi precedenti. La leadership del paese, con Kim Jong Un alla guida, ha continuato a gestire le relazioni internazionali, che hanno mostrato tensioni con gli Stati Uniti e la Corea del Sud, nonché con la comunità internazionale in merito alle violazioni dei diritti umani e alle sanzioni. La Corea del Nord ha anche continuato a sviluppare le sue capacità militari, inclusi i missili balistici, nonostante le sanzioni internazionali.",
  "fonti": [
    "cisa (PRK_AA20-239A_FASTCash2.0_508.pdf)",
    "mddr (Microsoft_Digital_Defense_Report_2020.pdf)",
    "wikipedia:PRK_2020"
  ]
}