{
  "paese": "USA",
  "periodo": "2021-Q2",
  "conflitto": {
    "descrizione": "Nel trimestre, non sono stati segnalati conflitti specifici di rilevanza. Tuttavia, si è assistito a un aumento di tensioni politiche e sociali, con proteste e manifestazioni legate a questioni di diritti civili e politica interna. L'attenzione è stata concentrata su eventi come la sentenza del processo per l'omicidio di George Floyd, che ha portato a proteste e scontri in diverse città. Inoltre, si è verificato un attacco al Senato degli Stati Uniti, che ha portato a una situazione di emergenza e alla chiusura temporanea del Congresso. L'atmosfera politica è stata caratterizzata da divisioni profonde, con discussioni intense sulle politiche di immigrazione e sulle riforme elettorali."
  },
  "carestia": {
    "livello_ipc": "non_specificato",
    "descrizione": null
  },
  "migrazione": {
    "descrizione": "Il trimestre ha visto un aumento delle tensioni legate alla politica di immigrazione, con discussioni e proteste su temi come il trattamento dei migranti e le politiche di asilo. Si è assistito a un aumento di richieste di asilo e di rifugiati che cercano di entrare negli Stati Uniti, con un focus particolare sulle condizioni di accoglienza e sulle politiche di gestione dei flussi migratori. L'accento è stato posto sulla protezione dei rifugiati e sulle condizioni di vita nei centri di accoglienza, con riferimenti specifici a gruppi vulnerabili come i minori non accompagnati."
  },
  "economia": {
    "sintesi": null
  },
  "cyber": {
    "incidenti_noti": [
      "Colonial Pipeline cyberattack: Un attacco ransomware ha colpito un oleodotto a Houston, causando la chiusura del sistema e una crisi di approvvigionamento di carburante lungo la costa orientale degli Stati Uniti.",
      "JBS S.A. cyberattack: Un attacco ransomware ha colpito diverse impianti di produzione di carne in Utah, Texas, Wisconsin, Nebraska e Pennsylvania, causando interruzioni significative nella produzione."
    ],
    "advisory_che_menzionano_il_paese": [
      "CFR Cyber Operations Tracker: Rapporto che documenta attività cibernetica di stato e attivita' di attori minaccia associati agli Stati Uniti.",
      "CISA Advisory: Avvisi che menzionano vulnerabilità e minacce specifiche per gli Stati Uniti.",
      "Microsoft Digital Defense Report: Rapporto che identifica attivita' di attori minaccia e vulnerabilità specifiche per gli Stati Uniti."
    ],
    "gruppi_minaccia_associati": [
      "DarkSide",
      "REvil"
    ],
    "settori_bersaglio": [
      "Energia",
      "Alimentare"
    ],
    "ruolo": "vittima"
  },
  "contesto_generale": "Nel trimestre, gli Stati Uniti hanno continuato a gestire le conseguenze della pandemia di COVID-19, con un aumento dei casi e delle morti. Si è assistito a un processo di riapertura graduale, con misure di distanziamento sociale e vaccinazioni che hanno cominciato a rallentare la diffusione del virus. Politicamente, il paese ha visto un periodo di transizione con l'insediamento del presidente Joe Biden, che ha introdotto nuove politiche e iniziative per affrontare la pandemia, il cambiamento climatico e le disuguaglianze sociali. L'atmosfera politica è stata caratterizzata da divisioni profonde, con discussioni intense sulle politiche di immigrazione, la riforma elettorale e i diritti civili. L'economia ha mostrato segni di ripresa, con un aumento delle vaccinazioni e delle misure di sostegno governative.",
  "fonti": [
    "unhcr_reports (USA_2021Q2_2021-05-20_statement-attributable-to-un-high-commissioner-for-refugees-.pdf)",
    "enisa (ENISA_Threat_Landscape_2021.pdf)",
    "mddr (Microsoft_Digital_Defense_Report_2021.pdf)",
    "wikipedia:USA_2021"
  ]
}