{
  "paese": "RUS",
  "periodo": "2019-Q3",
  "conflitto": {
    "descrizione": "Nel terzo trimestre del 2019, la Russia ha continuato a essere coinvolta in conflitti interni e internazionali. Durante questo periodo, si sono sviluppati sviluppi significativi legati alle proteste a Mosca, che hanno avuto origine dalla situazione delle elezioni alla Duma di Mosca. Inoltre, il paese ha continuato a gestire conseguenze di incidenti di rilevanza nazionale, come l'incidente nucleare di Nyonoksa, che ha causato cinque morti immediati. Questi eventi hanno evidenziato la persistente tensione politica e sociale all'interno del paese."
  },
  "carestia": {
    "livello_ipc": "non_specificato",
    "descrizione": null
  },
  "migrazione": {
    "descrizione": null
  },
  "economia": {
    "sintesi": null
  },
  "cyber": {
    "incidenti_noti": [],
    "advisory_che_menzionano_il_paese": [],
    "gruppi_minaccia_associati": [],
    "settori_bersaglio": [],
    "ruolo": "non_specificato"
  },
  "contesto_generale": "Nel terzo trimestre del 2019, la Russia è stata caratterizzata da una leadership stabile con Vladimir Putin come presidente e Dmitry Medvedev come primo ministro. Durante questo periodo, si sono sviluppati eventi significativi come le proteste a Mosca legate alle elezioni alla Duma di Mosca, l'incidente nucleare di Nyonoksa e l'incidente aereo di Ural Airlines, che hanno evidenziato la persistente tensione politica e sociale all'interno del paese. Inoltre, la Russia ha continuato a gestire conseguenze di incidenti di rilevanza nazionale, come l'incidente nucleare di Nyonoksa, che ha causato cinque morti immediati.",
  "fonti": [
    "wikipedia:RUS_2019"
  ]
}